[
  {
    "source": "chedraui",
    "retailer": "Chedraui (demo)",
    "productName": "Leche entera",
    "quantity": 1,
    "unit": "L",
    "priceCents": 3000,
    "currency": "MXN",
    "productUrl": "https://example.com/demo/chedraui/leche",
    "checkedAt": "2026-10-27T20:00:00Z"
  },
  {
    "source": "chedraui",
    "retailer": "Chedraui (demo)",
    "productName": "Huevos blancos",
    "quantity": 12,
    "unit": "piece",
    "priceCents": 4800,
    "currency": "MXN",
    "productUrl": "https://example.com/demo/chedraui/huevos",
    "checkedAt": "2026-10-27T20:00:00Z"
  },
  {
    "source": "chedraui",
    "retailer": "Chedraui (demo)",
    "productName": "Arroz blanco",
    "quantity": 1,
    "unit": "kg",
    "priceCents": 3200,
    "currency": "MXN",
    "productUrl": "https://example.com/demo/chedraui/arroz",
    "checkedAt": "2026-10-27T20:00:00Z"
  },
  {
    "source": "bodega-aurrera",
    "retailer": "Bodega Aurrera (demo)",
    "productName": "Leche entera",
    "quantity": 1,
    "unit": "L",
    "priceCents": 3200,
    "currency": "MXN",
    "productUrl": "https://example.com/demo/bodega-aurrera/leche",
    "checkedAt": "2026-10-27T20:00:00Z"
  },
  {
    "source": "bodega-aurrera",
    "retailer": "Bodega Aurrera (demo)",
    "productName": "Huevos blancos",
    "quantity": 12,
    "unit": "piece",
    "priceCents": 4200,
    "currency": "MXN",
    "productUrl": "https://example.com/demo/bodega-aurrera/huevos",
    "checkedAt": "2026-10-27T20:00:00Z"
  },
  {
    "source": "bodega-aurrera",
    "retailer": "Bodega Aurrera (demo)",
    "productName": "Arroz blanco",
    "quantity": 1,
    "unit": "kg",
    "priceCents": 3500,
    "currency": "MXN",
    "productUrl": "https://example.com/demo/bodega-aurrera/arroz",
    "checkedAt": "2026-10-27T20:00:00Z"
  },
  {
    "source": "chedraui",
    "retailer": "Chedraui (demo)",
    "productName": "Queso Oaxaca",
    "quantity": 400,
    "unit": "g",
    "priceCents": 8900,
    "currency": "MXN",
    "productUrl": "https://example.com/chedraui/queso-oaxaca-demo",
    "checkedAt": "2026-10-27T20:00:00Z"
  },
  {
    "source": "bodega-aurrera",
    "retailer": "Bodega Aurrera (demo)",
    "productName": "Queso Oaxaca",
    "quantity": 400,
    "unit": "g",
    "priceCents": 7900,
    "currency": "MXN",
    "productUrl": "https://example.com/bodega-aurrera/queso-oaxaca-demo",
    "checkedAt": "2026-10-27T20:00:00Z"
  }
]
